{
  "id": "us-udall-undergraduate-scholarship",
  "name": "Udall Undergraduate Scholarship",
  "sponsor": "Udall Foundation",
  "sponsor_type": "federal",
  "type": "scholarship",
  "award": {
    "amount_min": null,
    "amount_max": null,
    "currency": "USD",
    "basis": "field",
    "renewable": null,
    "notes": null
  },
  "deadline": {
    "type": "annual",
    "date": null,
    "notes": "Verify the current cycle's deadline against the source."
  },
  "eligibility": {
    "residency": [
      "US"
    ],
    "education_level": [
      "undergraduate"
    ],
    "fields_of_study": [],
    "gpa_min": null,
    "citizenship": [],
    "other": [
      "Students in environment fields, or Native American students in tribal health/policy"
    ],
    "tags": [
      "national"
    ]
  },
  "geo": {
    "state": null,
    "scope": "national",
    "counties": []
  },
  "links": {
    "info_url": "https://www.udall.gov/",
    "apply_url": null
  },
  "provenance": {
    "source_url": "https://www.udall.gov/",
    "source_name": "Udall Foundation",
    "last_verified": "2026-05-27",
    "verification_method": "research-summary",
    "added": "2026-05-27"
  },
  "status": "needs-review"
}
