{
  "id": "us-stamps-scholars",
  "name": "Stamps Scholars",
  "sponsor": "Stamps Family Charitable Foundation",
  "sponsor_type": "foundation",
  "type": "scholarship",
  "award": {
    "amount_min": null,
    "amount_max": null,
    "currency": "USD",
    "basis": "merit",
    "renewable": null,
    "notes": null
  },
  "deadline": {
    "type": "annual",
    "date": null,
    "notes": "Verify the current cycle's deadline against the source."
  },
  "eligibility": {
    "residency": [
      "US"
    ],
    "education_level": [
      "high-school-senior"
    ],
    "fields_of_study": [],
    "gpa_min": null,
    "citizenship": [],
    "other": [
      "Full-cost merit award at partner universities",
      "Leadership and impact focus"
    ],
    "tags": [
      "national"
    ]
  },
  "geo": {
    "state": null,
    "scope": "national",
    "counties": []
  },
  "links": {
    "info_url": "https://stampsscholars.org/",
    "apply_url": null
  },
  "provenance": {
    "source_url": "https://stampsscholars.org/",
    "source_name": "Stamps Family Charitable Foundation",
    "last_verified": "2026-05-27",
    "verification_method": "research-summary",
    "added": "2026-05-27"
  },
  "status": "needs-review"
}
