{
  "id": "us-coolidge-scholarship",
  "name": "Coolidge Scholarship",
  "sponsor": "Calvin Coolidge Presidential Foundation",
  "sponsor_type": "foundation",
  "type": "scholarship",
  "award": {
    "amount_min": null,
    "amount_max": null,
    "currency": "USD",
    "basis": "merit",
    "renewable": null,
    "notes": null
  },
  "deadline": {
    "type": "annual",
    "date": null,
    "notes": "Verify the current cycle's deadline against the source."
  },
  "eligibility": {
    "residency": [
      "US"
    ],
    "education_level": [
      "high-school-senior"
    ],
    "fields_of_study": [],
    "gpa_min": null,
    "citizenship": [],
    "other": [
      "Full-ride merit scholarship; apply as a high school junior (verify timing)"
    ],
    "tags": [
      "national"
    ]
  },
  "geo": {
    "state": null,
    "scope": "national",
    "counties": []
  },
  "links": {
    "info_url": "https://www.coolidgescholars.org/",
    "apply_url": "https://coolidgescholars.org/apply/"
  },
  "provenance": {
    "source_url": "https://www.coolidgescholars.org/",
    "source_name": "Calvin Coolidge Presidential Foundation",
    "last_verified": "2026-05-27",
    "verification_method": "manual",
    "added": "2026-05-27"
  },
  "status": "active"
}
