{
  "id": "nv-unlv-scholarships",
  "name": "UNLV Scholarships",
  "sponsor": "University of Nevada, Las Vegas",
  "sponsor_type": "institution",
  "type": "scholarship",
  "award": {
    "amount_min": null,
    "amount_max": null,
    "currency": "USD",
    "basis": "merit-need",
    "renewable": null,
    "notes": null
  },
  "deadline": {
    "type": "annual",
    "date": null,
    "notes": "Priority deadline for admission and financial aid applications required; specifi (auto-found \u2014 verify)"
  },
  "eligibility": {
    "residency": [
      "NV"
    ],
    "education_level": [
      "undergraduate"
    ],
    "fields_of_study": [],
    "gpa_min": 2.0,
    "citizenship": [],
    "other": [
      "Admitted/enrolled UNLV students",
      "Institutional + departmental awards"
    ],
    "tags": [
      "nevada"
    ]
  },
  "geo": {
    "state": "NV",
    "scope": "institution",
    "counties": []
  },
  "links": {
    "info_url": "https://www.unlv.edu/finaid/scholarships",
    "apply_url": "https://www.unlv.edu/finaid/apply"
  },
  "provenance": {
    "source_url": "https://www.unlv.edu/finaid/scholarships",
    "source_name": "University of Nevada, Las Vegas",
    "last_verified": "2026-05-27",
    "verification_method": "manual",
    "added": "2026-05-27"
  },
  "status": "active"
}
