{
  "id": "us-barry-goldwater-scholarship",
  "name": "Barry Goldwater Scholarship",
  "sponsor": "Barry Goldwater Scholarship Foundation",
  "sponsor_type": "federal",
  "type": "scholarship",
  "award": {
    "amount_min": null,
    "amount_max": null,
    "currency": "USD",
    "basis": "merit",
    "renewable": null,
    "notes": null
  },
  "deadline": {
    "type": "annual",
    "date": null,
    "notes": "Application opens first Tuesday in September; nomination deadline last Friday in (auto-found \u2014 verify)"
  },
  "eligibility": {
    "residency": [
      "US"
    ],
    "education_level": [
      "undergraduate"
    ],
    "fields_of_study": [],
    "gpa_min": null,
    "citizenship": [],
    "other": [
      "Sophomores/juniors pursuing research careers in STEM",
      "Nominated by their institution"
    ],
    "tags": [
      "national"
    ]
  },
  "geo": {
    "state": null,
    "scope": "national",
    "counties": []
  },
  "links": {
    "info_url": "https://goldwaterscholarship.gov/",
    "apply_url": "https://apply.scholarsapply.org/barrygoldwater/"
  },
  "provenance": {
    "source_url": "https://goldwaterscholarship.gov/",
    "source_name": "Barry Goldwater Scholarship Foundation",
    "last_verified": "2026-05-27",
    "verification_method": "manual",
    "added": "2026-05-27"
  },
  "status": "active"
}
