{
  "id": "us-american-welding-society-scholarships",
  "name": "American Welding Society Scholarships",
  "sponsor": "American Welding Society Foundation",
  "sponsor_type": "foundation",
  "type": "scholarship",
  "award": {
    "amount_min": null,
    "amount_max": null,
    "currency": "USD",
    "basis": "field",
    "renewable": null,
    "notes": null
  },
  "deadline": {
    "type": "annual",
    "date": null,
    "notes": "Verify the current cycle's deadline against the source."
  },
  "eligibility": {
    "residency": [
      "US"
    ],
    "education_level": [
      "vocational",
      "undergraduate"
    ],
    "fields_of_study": [],
    "gpa_min": null,
    "citizenship": [],
    "other": [
      "Students pursuing welding and welding-engineering education"
    ],
    "tags": [
      "national"
    ]
  },
  "geo": {
    "state": null,
    "scope": "national",
    "counties": []
  },
  "links": {
    "info_url": "https://www.aws.org/foundation/page/scholarships",
    "apply_url": "https://scholarship.aws.org/applications/"
  },
  "provenance": {
    "source_url": "https://www.aws.org/foundation/page/scholarships",
    "source_name": "American Welding Society Foundation",
    "last_verified": "2026-05-27",
    "verification_method": "research-summary",
    "added": "2026-05-27"
  },
  "status": "needs-review"
}
