{
  "id": "us-generation-google-scholarship",
  "name": "Generation Google Scholarship",
  "sponsor": "Google",
  "sponsor_type": "employer",
  "type": "scholarship",
  "award": {
    "amount_min": null,
    "amount_max": null,
    "currency": "USD",
    "basis": "identity",
    "renewable": null,
    "notes": null
  },
  "deadline": {
    "type": "annual",
    "date": null,
    "notes": "Verify the current cycle's deadline against the source."
  },
  "eligibility": {
    "residency": [
      "US"
    ],
    "education_level": [
      "undergraduate",
      "graduate"
    ],
    "fields_of_study": [],
    "gpa_min": null,
    "citizenship": [],
    "other": [
      "Computer science students from historically underrepresented groups",
      "Leadership + academic achievement"
    ],
    "tags": [
      "national"
    ]
  },
  "geo": {
    "state": null,
    "scope": "national",
    "counties": []
  },
  "links": {
    "info_url": "https://buildyourfuture.withgoogle.com/scholarships",
    "apply_url": "https://buildyourfuture.withgoogle.com/scholarships"
  },
  "provenance": {
    "source_url": "https://buildyourfuture.withgoogle.com/scholarships",
    "source_name": "Google",
    "last_verified": "2026-05-27",
    "verification_method": "research-summary",
    "added": "2026-05-27"
  },
  "status": "needs-review"
}
