{
  "id": "us-truman-scholarship",
  "name": "Truman Scholarship",
  "sponsor": "Harry S. Truman Scholarship Foundation",
  "sponsor_type": "federal",
  "type": "scholarship",
  "award": {
    "amount_min": null,
    "amount_max": null,
    "currency": "USD",
    "basis": "service",
    "renewable": null,
    "notes": null
  },
  "deadline": {
    "type": "annual",
    "date": null,
    "notes": "Verify the current cycle's deadline against the source."
  },
  "eligibility": {
    "residency": [
      "US"
    ],
    "education_level": [
      "undergraduate"
    ],
    "fields_of_study": [],
    "gpa_min": null,
    "citizenship": [],
    "other": [
      "College juniors committed to public-service careers",
      "Nominated by their institution"
    ],
    "tags": [
      "national"
    ]
  },
  "geo": {
    "state": null,
    "scope": "national",
    "counties": []
  },
  "links": {
    "info_url": "https://www.truman.gov/",
    "apply_url": null
  },
  "provenance": {
    "source_url": "https://www.truman.gov/",
    "source_name": "Harry S. Truman Scholarship Foundation",
    "last_verified": "2026-05-27",
    "verification_method": "research-summary",
    "added": "2026-05-27"
  },
  "status": "needs-review"
}
