{
  "id": "us-national-ffa-scholarships",
  "name": "National FFA Scholarships",
  "sponsor": "National FFA Organization",
  "sponsor_type": "foundation",
  "type": "scholarship",
  "award": {
    "amount_min": null,
    "amount_max": null,
    "currency": "USD",
    "basis": "field",
    "renewable": null,
    "notes": null
  },
  "deadline": {
    "type": "annual",
    "date": null,
    "notes": "Verify the current cycle's deadline against the source. \u00b7 previously listed 2023-01-01 \u2014 verify current cycle"
  },
  "eligibility": {
    "residency": [
      "US"
    ],
    "education_level": [
      "high-school-senior",
      "undergraduate"
    ],
    "fields_of_study": [],
    "gpa_min": null,
    "citizenship": [],
    "other": [
      "FFA members; agriculture and many other fields",
      "One application for many awards"
    ],
    "tags": [
      "national"
    ]
  },
  "geo": {
    "state": null,
    "scope": "national",
    "counties": []
  },
  "links": {
    "info_url": "https://www.ffa.org/participate/grants-and-scholarships/",
    "apply_url": "https://www.ffa.org/participate/grants-and-scholarships/"
  },
  "provenance": {
    "source_url": "https://www.ffa.org/participate/grants-and-scholarships/",
    "source_name": "National FFA Organization",
    "last_verified": "2026-05-27",
    "verification_method": "research-summary",
    "added": "2026-05-27"
  },
  "status": "needs-review"
}
